{
  "id": "fe-0501-your-case-name-v1",
  "familyId": "fe-your-case-name",
  "variant": 1,
  "suite": "frontend",
  "category": "ui-components",
  "difficulty": "medium",
  "mode": "agent",
  "capability": "feature",
  "fixture": "frontend-app",
  "prompt": "Implement the specific frontend change described here.",
  "rationale": "Explain which verification depths this case covers.",
  "preconditions": [
    {
      "type": "file_exists",
      "path": "package.json"
    }
  ],
  "checks": [
    {
      "type": "agent_exit",
      "equals": 0
    },
    {
      "type": "output_not_empty"
    },
    {
      "type": "jsonl_event",
      "event": "end"
    },
    {
      "type": "workspace_changed"
    },
    {
      "type": "file_exists",
      "path": "src/components/Example.tsx"
    },
    {
      "type": "file_contains",
      "path": "src/components/Example.tsx",
      "value": "export"
    },
    {
      "type": "command",
      "command": "npm run build",
      "timeoutMs": 180000
    }
  ]
}
